{
  "$schema": "../../../../shared/pylon-plugin-manifest.schema.json",
  "schema": 1,
  "id": "builtin.pylon-gateway",
  "name": "Pylon Gateway",
  "version": "1.0.0",
  "api": "1.0",
  "kind": "workspace",
  "web": { "entry": "./entry.ts", "styles": [] },
  "dependencies": {},
  "optionalDependencies": {},
  "conflicts": [],
  "activation": { "events": ["kernel.ready"] },
  "hotSwap": { "mode": "parallel", "drainTimeoutMs": 10000 }
}
